{
  "title": "DataHub",
  "template": "page.j2",
  "class": "twoColumns",
  "items": [
    {
      "label": "Release Notes",
      "class": "subject releaseNotes",
      "items": [
        {
          "label": "Release Notes",
          "id": "iccloudrncortina"
        }
      ]
    },
    {
      "label": "Features and functionality",
      "class": "subject featuresAndFunctionality",
      "items": [
        {
          "label": "Product Guide",
          "id": "iccloudproductcortina"
        },
        {
          "label": "BI Applications",
          "id": "iccloudbiappcortina"
        },
        {
          "label": "Reports",
          "id": "iccloudreportscortina"
        }
      ]
    },
    {
      "label": "Installation",
      "class": "subject installation",
      "items": [
        {
          "label": "Installation",
          "id": "iccloudinstallcortina"
        },
        {
          "label": "Upgrade",
          "id": "iccloudupgradecortina"
        }
      ]
    },
    {
      "label": "Configuration",
      "class": "subject configuration",
      "items": [
        {
          "label": "Configuration",
          "id": "iccloudconfigcortina"
        },
        {
          "label": "Data Specifications",
          "id": "icclouddataspeccortina"
        }
      ]
    },
    {
      "label": "Administration",
      "class": "subject administration",
      "items": [
        {
          "label": "Administration",
          "id": "iccloudadmincortina"
        }
      ]
    },
    {
      "label": "Development",
      "class": "subject development",
      "items": [
        {
          "label": "Developer Reference",
          "id": "icclouddevrefcortina"
        }
      ]
    },
    {
      "label": "Glossary",
      "class": "subject glossary",
      "items": [
        {
          "label": "Glossary",
          "id": "is202011glossary"
        }
      ]
    }
  ]
}