{
  "$schema": "/frontend/page-schema.json",
  "title": "ProducerEngage 2022.05",
  "template": "page",
  "class": "twoColumns",
  "items": [
    {
      "label": "Release Notes",
      "class": "subject releaseNotes",
      "items": [
        {
          "label": "Release Notes",
          "id": "dx202205perelnotes"
        }
      ]
    },
    {
      "label": "Installation",
      "class": "subject installation",
      "items": [
        {
          "label": "Installation Guide",
          "id": "dx202205peinstall"
        }
      ]
    },
    {
      "label": "Features and functionality",
      "class": "subject featuresAndFunctionality",
      "items": [
        {
          "label": "Application Guide",
          "id": "dx202205peapp"
        }
      ]
    },
    {
      "label": "Development",
      "class": "subject development",
      "items": [
        {
          "label": "Developer's Guide",
          "id": "dx202205pedev"
        },
        {
          "label": "Digital Services Reference Guides",
          "id": "dx202205perefguides"
        },
        {
          "label": "Digital Frontend API Documentation",
          "id": "dxjsdocs202205"
        }
      ]
    }
  ],
  "search_filters": {
    "platform": [
      "Cloud"
    ],
    "language": ["en"]
  }
}
