{
  "$schema": "../../../page-schema.json",
  "title": "Developer Resources",
  "template": "page",
  "class": "blue-theme dobson threeCards",
  "selector": {
    "label": "Select release",
    "selectedItem": "Dobson",
    "items": [
      {
        "label": "Cortina",
        "page": "../cortina"
      },
      {
        "label": "Banff",
        "page": "../banff"
      }
    ]
  },
  "items": [
    {
      "label": "InsuranceNow API reference",
      "class": "productFamily cardShadow",
      "id": "in20212apiref"
    },
    {
      "label": "ClaimCenter API reference",
      "class": "productFamily cardShadow",
      "id": "ccapirefdobson"
    },
    {
      "label": "PolicyCenter API reference",
      "class": "productFamily cardShadow",
      "id": "pcapirefdobson"
    },
    {
      "label": "APD API reference",
      "class": "productFamily cardShadow",
      "id": "pcapirefdobson",
      "env": ["int"]
    }
  ]
}
