{
  "title": "CustomerEngage Account Management for ClaimCenter",
  "template": "page",
  "class": "threeCards",
  "items": [
    {
      "label": "2022.05",
      "class": "categoryCard cardShadow",
      "items": [
        {
          "label": "Guía de la aplicación",
          "link": "/l10n/es-ES/ce-claims/2022.05/es-ES v.2022.05 CE-AM Claims_AppGuide.pdf"
        }
      ]
    }
  ]
}