{
  "title": "ServiceRepEngage",
  "template": "page",
  "class": "threeCards",
  "items": [
    {
      "label": "2022.05",
      "class": "categoryCard cardShadow",
      "items": [
        {
          "label": "Guida all'installazione",
          "link": "/l10n/it-IT/sre/2022.05/it-IT Digital v.2022.05 SRE InstallGuide.pdf"
        },
        {
          "label": "Guida all'applicazione",
          "link": "/l10n/it-IT/sre/2022.05/it-IT Digital v.2022.05 SRE_AppGuide.pdf"
        }
      ]
    },
    {
      "label": "11.3",
      "class": "categoryCard cardShadow",
      "items": [
        {
          "label": "Guida all'installazione",
          "link": "/l10n/it-IT/sre/11.3/it-SRE-IT - 11.3-onprem-InstallGuide.pdf"
        }
      ]
    },
    {
      "label": "10.0.1",
      "class": "categoryCard cardShadow",
      "items": [
        {
          "label": "Guida all'applicazione",
          "link": "/l10n/it-IT/sre/10.0.1/it-SRE_AppGuide.pdf"
        }
      ]
    }
  ]
}