{
  "$schema": "/frontend/page-schema.json",
  "title": "CustomerEngage Account Management for ClaimCenter",
  "template": "page",
  "class": "threeCards version it-IT l10n",
  "items": [
    {
      "label": "2022.05",
      "class": "categoryCard cardShadow",
      "items": [
        {
          "label": "Guida all'applicazione",
          "link": "/l10n/pdfs/it-IT/ce-claims/2022.05/it-IT Digital v.2022.05 CE-AM Claims_AppGuide.pdf"
        },
        {
          "label": "Guida all'installazione",
          "link": "/l10n/pdfs/it-IT/ce-claims/2022.05/it-IT Digital v.2022.05 CE-AM Claims InstallGuide.pdf"
        }
      ]
    },
    {
      "label": "11.3",
      "class": "categoryCard cardShadow",
      "items": [
        {
          "label": "Guida all'installazione",
          "link": "/l10n/pdfs/it-IT/ce-claims/11.3/it-CE-Claims-11.3-onprem- InstallGuide.pdf"
        }
      ]
    }
  ],
  "selector": {
    "label": "Seleziona il prodotto",
    "selectedItem": "CustomerEngage Account Management for ClaimCenter",
    "items": [
      {
        "label": "BillingCenter",
        "page": "../bc"
      },
      {
        "label": "ClaimCenter",
        "page": "../cc"
      },
      {
        "label": "Cloud Data Access",
        "page": "../cda"
      },
      {
        "label": "CustomerEngage Account Management",
        "page": "../ce-am"
      },
      {
        "label": "CustomerEngage Quote and Buy",
        "page": "../ce-qb"
      },
      {
        "label": "DataHub",
        "page": "../dh"
      },
      {
        "label": "Guidewire Cloud Console",
        "page": "../gcc"
      },
      {
        "label": "Guidewire Identity Federation Hub",
        "page": "../gwid"
      },
      {
        "label": "InfoCenter",
        "page": "../ic"
      },
      {
        "label": "PolicyCenter",
        "page": "../pc"
      },
      {
        "label": "ProducerEngage",
        "page": "../pe"
      },
      {
        "label": "ProducerEngage for ClaimCenter",
        "page": "../pe-claims"
      },
      {
        "label": "ServiceRepEngage",
        "page": "../sre"
      },
      {
        "label": "VendorEngage",
        "page": "../ve"
      }
    ]
  }
}