{
  "$schema": "/frontend/page-schema.json",
  "title": "Self-managed",
  "template": "page",
  "class": "threeCards self-managed",
  "items": [
    {
      "label": "Core",
      "class": "categoryCard cardShadow",
      "items": [
        {
          "label": "What's New for Self-Managed Implementations",
          "link": "https://www.brainshark.com/1/player/guidewire?pi=zGSzK26rDzeZ1oz0&r3f1=&fb=0"
        },
        {
          "label": "PolicyCenter",
          "page": "pc/10.2.1"
        },
        {
          "label": "ClaimCenter",
          "page": "cc/10.2.1"
        },
        {
          "label": "BillingCenter",
          "page": "bc/10.2.1"
        },
        {
          "label": "InsuranceSuite Configuration Upgrade Tools",
          "id": "isconfigupgradetools440"
        },
        {
          "label": "InsuranceSuite Configuration Upgrade Tools Compatibility",
          "id": "isupgradecompatibility"
        },
        {
          "label": "REST API Client",
          "id": "isrestapiclientguide"
        },
        {
          "label": "REST API Client Release Notes",
          "id": "isrestapiclientrn"
        },
        {
          "label": "Guidewire for Salesforce",
          "page": "gwsf/di/3.4"
        },
        {
          "label": "Global Content",
          "class": "group",
          "items": [
            {
              "label": "France",
              "page": "../globalContent/ipf/2.0"
            },
            {
              "label": "Germany",
              "page": "../globalContent/ipg/latest"
            }
          ]
        }
      ]
    },
    {
      "label": "Analytics",
      "class": "categoryCard cardShadow",
      "items": [
        {
          "label": "DataHub",
          "page": "dh/10.8.0"
        },
        {
          "label": "InfoCenter",
          "page": "ic/10.8.0"
        },
        {
          "label": "DataHub",
          "page": "dh/10.7.0",
          "env": ["prod"]
        },
        {
          "label": "InfoCenter",
          "page": "ic/10.7.0",
          "env": ["prod"]
        }
      ]
    },
    {
      "label": "Digital",
      "class": "categoryCard cardShadow",
      "items": [
        {
          "label": "CustomerEngage Account Management",
          "id": "dxceam1141"
        },
        {
          "label": "CustomerEngage Account Management for ClaimCenter",
          "id": "dxceclaims1141"
        },
        {
          "label": "CustomerEngage Quote and Buy",
          "id": "dxceqb1141"
        },
        {
          "label": "Jutro Design System",
          "page": "../jutroDesignSystem/5.3.1",
          "env": ["dev", "staging", "prod", "int"]
        },
        {
          "label": "ProducerEngage",
          "id": "dxpe1141"
        },
        {
          "label": "ProducerEngage for ClaimCenter",
          "id": "dxpeclaims1141"
        },
        {
          "label": "ServiceRepEngage",
          "id": "dxsre1141"
        },
        {
          "label": "VendorEngage",
          "id": "dxve1141"
        }
      ]
    }
  ],
  "search_filters": {
    "platform": ["Self-managed"]
  }
}
