{
  "$schema": "/frontend/page-schema.json",
  "title": "PolicyCenter for Guidewire Cloud 2021.11",
  "template": "page",
  "class": "twoColumns",
  "selector": {
    "label": "Select release",
    "selectedItem": "Dobson (2021.11)",
    "items": [
      {
        "label": "Flaine (2022.09)",
        "page": "../../../flaine/pcGwCloud/2022.09"
      },
      {
        "label": "Elysian (2022.05)",
        "page": "../../../elysian/pcGwCloud/2022.05"
      },
      {
        "label": "Cortina (2021.04)",
        "page": "../../../cortina/policyCenterCloud/pcGwCloud/2021.04"
      },
      {
        "label": "Banff (2020.11)",
        "page": "../../../banff/policyCenterCloud/pcGwCloud/2020.11"
      },
      {
        "label": "Aspen (2020.05)",
        "page": "../../../aspen/policyCenterCloud"
      }
    ]
  },
  "items": [
    {
      "label": "Release Notes",
      "class": "subject releaseNotes",
      "items": [
        {
          "label": "Release Notes",
          "id": "ispc202111releasenotes"
        },
        {
          "label": "New and Changed",
          "id": "ispc202111newandchanged"
        },
        {
          "label": "Guidewire Testing Framework Release Notes",
          "id": "testingframeworksrndobson"
        },
        {
          "label": "InsuranceSuite Configuration Upgrade Tools",
          "id": "isconfigupgradetools450"
        },
        {
          "label": "InsuranceSuite Configuration Upgrade Tools Compatibility",
          "id": "isupgradecompatibility"
        }
      ]
    },
    {
      "label": "Installation",
      "class": "subject installation",
      "items": [
        {
          "label": "Developer Setup",
          "id": "ispc202111devsetup"
        },
        {
          "label": "Upgrade",
          "id": "ispc202111upgrade"
        }
      ]
    },
    {
      "label": "Features and functionality",
      "class": "subject featuresAndFunctionality",
      "items": [
        {
          "label": "Application Guide",
          "id": "ispc202111app"
        },
        {
          "label": "Contact Management",
          "id": "is202111contact"
        }
      ]
    },
    {
      "label": "Administration",
      "class": "subject administration",
      "items": [
        {
          "label": "Administration",
          "id": "ispc202111admin"
        },
        {
          "label": "Data Archiving",
          "id": "ispc202111dataarchiving"
        }
      ]
    },
    {
      "label": "Configuration",
      "class": "subject configuration",
      "items": [
        {
          "label": "Advanced Product Designer in PolicyCenter",
          "id": "ispc202111apd"
        },
        {
          "label": "Configuration",
          "id": "ispc202111config"
        },
        {
          "label": "Globalization",
          "id": "ispc202111global"
        },
        {
          "label": "Gosu Rules",
          "id": "ispc202111rules"
        },
        {
          "label": "Product Designer",
          "id": "ispc202111pd"
        },
        {
          "label": "Product Model",
          "id": "ispc202111pm"
        }
      ]
    },
    {
      "label": "Integration",
      "class": "subject integration",
      "items": [
        {
          "label": "Overview of Cloud Integration",
          "id": "is202111integoverview"
        },
        {
          "label": "Cloud API Authentication",
          "id": "ispc202111apica"
        },
        {
          "label": "Cloud API Business Flows and Configuration",
          "id": "ispc202111apibf"
        },
        {
          "label": "Cloud API ContactManager",
          "id": "ispc202111apicm"
        },
        {
          "label": "Cloud API Reference",
          "id": "pcapirefdobson"
        },
        {
          "label": "Plugins, Prebuilt Integrations, and SOAP APIs",
          "id": "ispc202111integ"
        },
        {
          "label": "REST API Framework",
          "id": "ispc202111restapifw"
        },
        {
          "label": "REST API Client",
          "id": "isrestapiclientguide"
        }
      ]
    },
    {
      "label": "Development",
      "class": "subject development",
      "items": [
        {
          "label": "Gosu Reference",
          "id": "gosureflatest"
        },
        {
          "label": "GUnit Testing",
          "id": "ispc202111testing"
        },
        {
          "label": "API Testing (GT: API)",
          "id": "testingframeworksapidobson"
        },
        {
          "label": "User Interface Testing (GT: UI)",
          "id": "testingframeworksuidobson"
        }
      ]
    },
    {
      "label": "Glossary",
      "class": "subject glossary",
      "items": [
        {
          "label": "Glossary",
          "id": "gwglossary"
        }
      ]
    }
  ]
}
