{
  "$schema": "/frontend/page-schema.json",
  "title": "Feature Preview - Early Access Documentation",
  "template": "page",
  "class": "twoColumns featurePreview",
  "items": [
    {
      "label": "Jutro",
      "class": "subject development",
      "items": [
        {
          "label": "Jutro Digital Platform",
          "id": "jutroplatformnext"
        },
        {
          "label": "Jutro SDK",
          "id": "jutrosdknext"
        }
      ]
    },
    {
      "label": "Rules",
      "class": "subject releaseNotes",
      "items": [
        {
          "label": "Guidewire Rules Release Notes",
          "id": "gwrulesrn"
        },
        {
          "label": "Guidewire Rules",
          "id": "gwrules"
        }
      ]
    },
    {
      "label": "Integration Framework",
      "class": "subject development",
      "items": [
        {
          "label": "App Events Release Notes",
          "id": "appeventsrn"
        },
        {
          "label": "App Events for Developers",
          "id": "appeventsdev"
        },
        {
          "label": "Webhooks API Reference",
          "id": "webhooksapinext"
        }
      ]
    },
    {
      "label": "Testing",
      "class": "subject bestPractices",
      "items": [
        {
          "label": "Data Masking",
          "id": "datamasking"
        },
        {
          "label": "Load and Performance Testing",
          "id": "testingframeworksloadflaine"
        },
        {
          "label": "User Interface Accessibility Testing",
          "id": "is202209access"
        }
      ]
    },
    {
      "label": "Rating",
      "class": "subject configuration",
      "items": [
        {
          "label": "Cloud Rating",
          "id": "cloudratingdraft"
        }
      ]
    },
    {
      "label": "Data",
      "class": "subject featuresAndFunctionality",
      "items": [
        {
          "label": "Data Studio",
          "id": "datastudiorelease"
        },
        {
          "label": "Data Studio",
          "id": "datastudiodraft"
        }
      ]
    },
    {
      "label": "Advanced Product Designer for Claims",
      "class": "subject development",
      "items": [
        {
          "label": "APD for Claims Guide",
          "id": "apdclaims"
        }
      ]
    },
    {
      "label": "Cloud Console",
      "class": "subject featuresAndFunctionality",
      "items": [
        {
          "label": "Cloud Console Root Doc Early Access",
          "id": "guidewirecloudconsolerootearlyaccess"
        }
      ]
    },
    {
      "label": "Configuration",
      "class": "subject configuration",
      "items": [
        {
          "label": "Experience Manager",
          "id": "experiencemgrdraft"
        },
        {
          "label": "String Manager",
          "id": "stringmanagerpcdraft"
        },
        {
          "label": "Workset Manager",
          "id": "worksetmgr"
        }
      ]
    }
  ]
}
