{
  "$schema": "/frontend/page-schema.json",
  "title": "PolicyCenter",
  "template": "page",
  "class": "threeCards version ja-JP l10n",
  "items": [
    {
      "label": "Gosu リファレンスガイド",
      "class": "categoryCard cardShadow",
      "id": "gosureflatestjaJP"
    },
    {
      "label": "Integration Gateway",
      "class": "categoryCard cardShadow",
      "id": "integgatewaydevlatestjaJP"
    },
    {
      "label": "2021.04 Cortina",
      "class": "categoryCard cardShadow",
      "items": [
        {
          "label": "ルールガイド",
          "link": "/l10n/pdfs/ja-JP/pc/2021.04 Cortina/PC_CL202104_ja-JP_RulesGuide.pdf"
        },
        {
          "label": "テストガイド",
          "link": "/l10n/pdfs/ja-JP/pc/2021.04 Cortina/PC_CL202104_ja-JP_TestingGuide.pdf"
        }
      ]
    },
    {
      "label": "2020.11 Banff",
      "class": "categoryCard cardShadow",
      "items": [
        {
          "label": "インストールガイド",
          "link": "/l10n/pdfs/ja-JP/pc/2020.11 Banff/PCCloud202011_ja-JP_InstallGuide.pdf"
        },
        {
          "label": "Advanced Product Designer ガイド",
          "link": "/l10n/pdfs/ja-JP/pc/2020.11 Banff/Cloud202011_ja-JP_AdvancedProductDesigner.pdf"
        },
        {
          "label": "コンフィギュレーションガイド",
          "link": "/l10n/pdfs/ja-JP/pc/2020.11 Banff/PCCloud202011_ja-JP_ConfigGuide.pdf"
        }
      ]
    },
    {
      "label": "2020.05 Aspen",
      "class": "categoryCard cardShadow",
      "items": [
        {
          "label": "Guidewire 連絡先管理ガイド",
          "link": "/l10n/pdfs/ja-JP/pc/2020.05 Aspen/IS_CL202005-PC-ContactMgmtGuide-ja_JP.pdf"
        },
        {
          "label": "アプリケーションガイド",
          "link": "/l10n/pdfs/ja-JP/pc/2020.05 Aspen/IS_CL202005-PC-AppGuide-ja_JP.pdf"
        }
      ]
    },
    {
      "label": "10.1.1",
      "class": "categoryCard cardShadow",
      "items": [
        {
          "label": "インストールガイド",
          "link": "/l10n/pdfs/ja-JP/pc/10.1.1/PC1011_ja-JP_InstallGuide.pdf"
        }
      ]
    },
    {
      "label": "10.0.2",
      "class": "categoryCard cardShadow",
      "items": [
        {
          "label": "インストールガイド",
          "link": "/l10n/pdfs/ja-JP/pc/10.0.2/ja-PC-InstallGuide.pdf"
        },
        {
          "label": "ルールガイド",
          "link": "/l10n/pdfs/ja-JP/pc/10.0.2/ja-PC-RulesGuide.pdf"
        },
        {
          "label": "保険商品モデルガイド",
          "link": "/l10n/pdfs/ja-JP/pc/10.0.2/ja-PC-ProductModelGuide.pdf"
        },
        {
          "label": "システム管理ガイド",
          "link": "/l10n/pdfs/ja-JP/pc/10.0.2/ja-PC-AdminGuide.pdf"
        },
        {
          "label": "連携ガイド",
          "link": "/l10n/pdfs/ja-JP/pc/10.0.2/ja-PC-IntegrationGuide.pdf"
        },
        {
          "label": "Gosu リファレンスガイド",
          "link": "/l10n/pdfs/ja-JP/pc/10.0.2/ja-PC-GosuRefGuide.pdf"
        },
        {
          "label": "Guidewire 連絡先管理ガイド",
          "link": "/l10n/pdfs/ja-JP/pc/10.0.2/ja-PC-ContactMgmtGuide.pdf"
        },
        {
          "label": "PolicyCenter  用語集",
          "link": "/l10n/pdfs/ja-JP/pc/10.0.2/ja-PC-Glossary.pdf"
        },
        {
          "label": "Product Designer ガイド",
          "link": "/l10n/pdfs/ja-JP/pc/10.0.2/ja-PC-ProductDesignerGuide.pdf"
        },
        {
          "label": "コンフィギュレーションガイド",
          "link": "/l10n/pdfs/ja-JP/pc/10.0.2/ja-PC-ConfigGuide.pdf"
        },
        {
          "label": "アプリケーションガイド",
          "link": "/l10n/pdfs/ja-JP/pc/10.0.2/ja-PC-AppGuide.pdf"
        },
        {
          "label": "ベストプラクティスガイド",
          "link": "/l10n/pdfs/ja-JP/pc/10.0.2/ja-PC-BestPracticesGuide.pdf"
        }
      ]
    },
    {
      "label": "10.0.0",
      "class": "categoryCard cardShadow",
      "items": [
        {
          "label": "インストールガイド",
          "link": "/l10n/pdfs/ja-JP/pc/10.0.0/ja-PC-InstallGuide.pdf"
        },
        {
          "label": "ルールガイド",
          "link": "/l10n/pdfs/ja-JP/pc/10.0.0/ja-PC-RulesGuide.pdf"
        },
        {
          "label": "保険商品モデルガイド",
          "link": "/l10n/pdfs/ja-JP/pc/10.0.0/ja-PC-ProductModelGuide.pdf"
        },
        {
          "label": "連携ガイド",
          "link": "/l10n/pdfs/ja-JP/pc/10.0.0/ja-PC-IntegrationGuide.pdf"
        },
        {
          "label": "連絡先管理ガイド",
          "link": "/l10n/pdfs/ja-JP/pc/10.0.0/ja-PC-ContactMgmtGuide.pdf"
        },
        {
          "label": "Product Designer ガイド",
          "link": "/l10n/pdfs/ja-JP/pc/10.0.0/ja-PC-ProductDesignerGuide.pdf"
        },
        {
          "label": "コンフィギュレーションガイド",
          "link": "/l10n/pdfs/ja-JP/pc/10.0.0/ja-PC-ConfigGuide.pdf"
        },
        {
          "label": "アプリケーションガイド",
          "link": "/l10n/pdfs/ja-JP/pc/10.0.0/ja-PC-AppGuide.pdf"
        },
        {
          "label": "ベストプラクティスガイド",
          "link": "/l10n/pdfs/ja-JP/pc/10.0.0/ja-PC-BestPracticesGuide.pdf"
        }
      ]
    }
  ],
  "selector": {
    "label": "製品を選択",
    "selectedItem": "PolicyCenter",
    "items": [
      {
        "label": "Garmisch (2023.02) の新機能",
        "page": "../202302garmischwhatsnew"
      },
      {
        "label": "BillingCenter",
        "page": "../bc"
      },
      {
        "label": "ClaimCenter",
        "page": "../cc"
      },
      {
        "label": "CustomerEngage Account Management",
        "page": "../ce-am"
      },
      {
        "label": "CustomerEngage Account Management for ClaimCenter",
        "page": "../ce-claims"
      },
      {
        "label": "CustomerEngage Quote and Buy",
        "page": "../ce-qb"
      },
      {
        "label": "InsuranceSuite Contact Management",
        "page": "../cm"
      },
      {
        "label": "Cloud Platform",
        "page": "../cp"
      },
      {
        "label": "Guidewire Testing",
        "page": "../gtest"
      },
      {
        "label": "Guidewire Identity Federation Hub",
        "page": "../gwid"
      },
      {
        "label": "Guidewire for Salesforce",
        "page": "../gwsf"
      },
      {
        "label": "InsuranceSuite Configuration Upgrade Tools",
        "page": "../is-configupgradetools"
      },
      {
        "label": "ProducerEngage",
        "page": "../pe"
      },
      {
        "label": "ServiceRepEngage",
        "page": "../sre"
      },
      {
        "label": "VendorEngage",
        "page": "../ve"
      }
    ]
  },
  "search_filters": {
    "language": ["ja"]
  }
}