{
  "$schema": "/frontend/page-schema.json",
  "title": "IRSA Integration for ClaimCenter (version 1.1)",
  "template": "page.j2",
  "class": "twoColumns",
  "items": [
    {
      "label": "Release Notes",
      "class": "subject releaseNotes",
      "items": [
        {
          "label": "Release Notes",
          "id": "midipfrndraft"
        }
      ]
    },
    {
      "label": "Features and functionality",
      "class": "subject featuresAndFunctionality",
      "items": [
        {
          "label": "Overview",
          "id": "midipfoverviewdraft"
        },
        {
          "label": "Adjuster Guide",
          "id": "midipfadjusterdraft"
        }
      ]
    },
    {
      "label": "Administration",
      "class": "subject administration",
      "items": [
        {
          "label": "Administration Guide",
          "id": "midipfadmindraft"
        }
      ]
    }
  ]
}
