{
  "$schema": "/frontend/page-schema.json",
  "title": "PolicyCenter for Guidewire Cloud earlyaccess",
  "template": "page.j2",
  "class": "twoColumns",
  "selector": {
    "label": "Select version",
    "selectedItem": "earlyaccess",
    "items": [
      {
        "label": "latest",
        "page": "../latest"
      }
    ]
  },
  "items": [
    {
      "label": "Release Notes",
      "class": "subject releaseNotes",
      "items": [
        {
          "label": "Release Notes",
          "id": "ispccloudeareleasenotes"
        },
        {
          "label": "New and Changed",
          "id": "ispccloudeanewandchanged"
        }
      ]
    },
    {
      "label": "Installation",
      "class": "subject installation",
      "items": [
        {
          "label": "Installation",
          "id": "ispccloudeainstall"
        },
        {
          "label": "Upgrade",
          "id": "ispccloudeaupgrade"
        }
      ]
    },
    {
      "label": "Features and functionality",
      "class": "subject featuresAndFunctionality",
      "items": [
        {
          "label": "Application Guide",
          "id": "ispccloudeaapp"
        },
        {
          "label": "Contact Management",
          "id": "iscloudeacontact"
        }
      ]
    },
    {
      "label": "Administration",
      "class": "subject administration",
      "items": [
        {
          "label": "Administration",
          "id": "ispccloudeaadmin"
        }
      ]
    },
    {
      "label": "Best Practices",
      "class": "subject bestPractices",
      "items": [
        {
          "label": "Best practices",
          "id": "ispccloudeabestpractice"
        }
      ]
    },
    {
      "label": "Configuration",
      "class": "subject configuration",
      "items": [
        {
          "label": "Advanced Product Designer",
          "id": "ispccloudeaapd"
        },
        {
          "label": "Configuration",
          "id": "ispccloudeaconfig"
        },
        {
          "label": "Globalization",
          "id": "ispccloudeaglobal"
        },
        {
          "label": "Rules",
          "id": "ispccloudearules"
        },
        {
          "label": "Product Designer",
          "id": "ispccloudeapd"
        },
        {
          "label": "Product Model",
          "id": "ispccloudeapm"
        }
      ]
    },
    {
      "label": "Integration",
      "class": "subject integration",
      "items": [
        {
          "label": "Integration",
          "id": "ispccloudeainteg"
        },
        {
          "label": "Cloud API Developer Guide",
          "id": "ispccloudeacloudapi"
        },
        {
          "label": "REST API Framework",
          "id": "ispccloudearestapifw"
        },
        {
          "label": "REST API Client",
          "id": "iscloudearestapiclient"
        }
      ]
    },
    {
      "label": "Development",
      "class": "subject development",
      "items": [
        {
          "label": "Gosu Reference",
          "id": "ispccloudeagosu"
        },
        {
          "label": "Test Automation Guide",
          "id": "ispccloudeatesting"
        }
      ]
    },
    {
      "label": "Glossary",
      "class": "subject glossary",
      "items": [
        {
          "label": "Glossary",
          "id": "iscloudeaglossary"
        }
      ]
    }
  ]
}