{
  "$schema": "/frontend/page-schema.json",
  "title": "ClaimCenter Package for France",
  "template": "page",
  "class": "twoColumns",
  "items": [
    {
      "label": "Release Notes",
      "class": "subject releaseNotes",
      "items": [
        {
          "label": "Release Notes",
          "id": "midipfcloudrn"
        }
      ]
    },
    {
      "label": "Features and functionality",
      "class": "subject featuresAndFunctionality",
      "items": [
        {
          "label": "Overview",
          "id": "midipfcloudoverview"
        },
        {
          "label": "Adjuster Guide",
          "id": "midipfcloudadjuster"
        }
      ]
    },
    {
      "label": "Administration",
      "class": "subject administration",
      "items": [
        {
          "label": "Administration Guide",
          "id": "midipfcloudadmin"
        }
      ]
    }
  ]
}
