{
  "$schema": "/frontend/page-schema.json",
  "title": "Global Content - Message Store",
  "template": "page",
  "class": "twoColumns",
  "items": [
    {
      "label": "Release Notes",
      "class": "subject releaseNotes",
      "items": [
        {
          "label": "Release Notes",
          "id": "gondolasmsrninnsbruck"
        }
      ]
    },
    {
      "label": "Features and functionality",
      "class": "subject featuresAndFunctionality",
      "items": [
        {
          "label": "Application Guide",
          "id": "gondolasmsappinnsbruck"
        }
      ]
    },
    {
      "label": "Installation",
      "class": "subject installation",
      "items": [
        {
          "label": "Installation and Deployment",
          "id": "gondolasmsinstallinnsbruck"
        }
      ]
    },
    {
      "label": "Configuration",
      "class": "subject configuration",
      "items": [
        {
          "label": "Configuration",
          "id": "gondolasmsconfiginnsbruck"
        }
      ]
    },
    {
      "label": "Integration",
      "class": "subject integration",
      "items": [
        {
          "label": "Integration",
          "id": "gondolasmsinteginnsbruck"
        }
      ]
    }
  ],
  "search_filters": {
    "language": ["en"]
  }
}
